{
  "media_authorizations": [
    {
      "artifact_id": "synthetic-first-playable",
      "consent_ref": {
        "artifact_id": "synthetic-consent-record",
        "digest": {
          "algorithm": "sha256",
          "value": "1111111111111111111111111111111111111111111111111111111111111111"
        },
        "media_type": "application/pdf"
      },
      "custody": "owner_controlled",
      "guardian_authorization_ref": {
        "artifact_id": "synthetic-guardian-authorization",
        "digest": {
          "algorithm": "sha256",
          "value": "2222222222222222222222222222222222222222222222222222222222222222"
        },
        "media_type": "application/pdf"
      },
      "publication_grant": "unknown",
      "purpose_grants": [
        {
          "grant_ref": {
            "artifact_id": "synthetic-publication-grant",
            "digest": {
              "algorithm": "sha256",
              "value": "3333333333333333333333333333333333333333333333333333333333333333"
            },
            "media_type": "application/pdf"
          },
          "granted": true,
          "purpose": "public_evidence"
        },
        {
          "granted": false,
          "purpose": "marketing"
        }
      ]
    }
  ],
  "private_extensions": {
    "internal_job_reference": "synthetic-internal-job-6f2a41c8",
    "operator_note": "Synthetic producer note that is never projected."
  },
  "producer": {
    "receipt_id": "synthetic-producer-receipt",
    "repository": "synthetic-producer-repository",
    "revision": "0123456789abcdef0123456789abcdef01234567"
  },
  "projection": {
    "projected_at": "2026-08-27T00:00:00Z",
    "public_record_digest": {
      "algorithm": "sha256",
      "value": "bf64cb036fd292f96c0ef60ec077adcdb349d145994913c0bcca1492ba746eac"
    }
  },
  "public": {
    "available_match_count": 4,
    "awaiting_next_instruction": true,
    "completeness_reported": true,
    "cost_usd": 0,
    "first_playable_ref": {
      "artifact_id": "synthetic-first-playable",
      "digest": {
        "algorithm": "sha256",
        "value": "efefefefefefefefefefefefefefefefefefefefefefefefefefefefefefefef"
      },
      "media_type": "video/mp4"
    },
    "human_decision_required": true,
    "instruction": "Show me all the unforced errors of Player A in their last five matches as a video, keeping only the last three shots of each rally.",
    "matched_rally_count": 1,
    "omissions": [
      {
        "detail": "Synthetic example reports fewer than five available matches.",
        "reason": "inaccessible_match",
        "scope_ref": "match-slot-5"
      }
    ],
    "perception_rerun": false,
    "plan_digest": {
      "algorithm": "sha256",
      "value": "22215244686b064e1cbf1e922b20f302eafe4682bfb86669c478f64178b31b6d"
    },
    "plan_id": "synthetic-unforced-error-plan",
    "prescriptive_advice_emitted": false,
    "provenance_counts": {
      "coach_assertion": 0,
      "derived_calculation": 1,
      "human_confirmed": 1,
      "model_observation": 3,
      "unknown": 0
    },
    "recipe_digest": {
      "algorithm": "sha256",
      "value": "71b773304a2144125ee214cf0520de027ee5e0411956cd589ad25b5da8979330"
    },
    "recipe_id": "synthetic-unforced-error-reel",
    "record_id": "coach-agent-receipt-synthetic-v1",
    "requested_match_count": 5,
    "result_artifacts": [
      {
        "artifact_id": "synthetic-first-playable",
        "digest": {
          "algorithm": "sha256",
          "value": "efefefefefefefefefefefefefefefefefefefefefefefefefefefefefefefef"
        },
        "media_type": "video/mp4"
      }
    ],
    "run_id": "synthetic-coach-agent-run",
    "schema_name": "CoachAgentRunReceiptV1",
    "schema_version": "1.0.0",
    "timings": {
      "full_completion_seconds": 2,
      "intent_to_plan_seconds": 0.1,
      "plan_to_recipe_seconds": 0.2,
      "recipe_to_first_playable_seconds": 1.5
    }
  },
  "record_id": "private-record-unauthorized-media-grant",
  "schema_name": "PrivateEvidenceRecordV1",
  "schema_version": "1.0.0"
}
